<?xml version="1.0"?>
<Report xmlns:xsi="http://www.w3.org/2001/XMLSchema-instance" xsi:noNamespaceSchemaLocation="TransactionFK.xsd">

	<Transaction>
		<id>1</id>
		<idMerchant>11</idMerchant>
		<idTerminal>111</idTerminal>
		<idClerk>1111</idClerk>
		<idClient>11111</idClient>
		<mode>Credit</mode>
		<operation>Sale</operation>
		<cardBrand>Visa</cardBrand>
		<subTotalAmount>111.22</subTotalAmount>
		<tipAmount>0</tipAmount>
		<taxAmount>0</taxAmount>
		<totalAmount>733.77</totalAmount>
		<cvv />
		<xxxclient />
		<cardHolderEmail />
		<geoLocation/>
		<signature />
		<account />
		<allowPartialAuth>false</allowPartialAuth>
		<formatID />
		<ksn />
		<encTrack1AndTrack2 />
		<track1Length />
		<track2Length />
		<maskedPAN />
		<swipe />
		<pin />
		<authNumber />
		<disposition>APPROVED 0091</disposition>
		<sequence>17</sequence>
		<approvalNumber/>
		<approvalCode>91</approvalCode>
		<accountSuffix>4242</accountSuffix>
		<voided>false</voided>
		<poNumber />
		<invoiceNumber />
		<createdAt>1383176096000</createdAt>
		<finalized>false</finalized>
		<hostCapture>true</hostCapture>
		<retrievalData>131030193503000000000000000</retrievalData>
		<batchNumber>131030999</batchNumber>
		<cvvResult />
		<entryMethod>0</entryMethod>
		<debugMessage />
		<amountAuthorized>0</amountAuthorized>
		<originalSequenceNumber />
		<originalApprovalNumber />
		<originalRetrievalData />
		<originalCVVResult />
		<clientStartTime>0</clientStartTime>
		<frontStartTime>0</frontStartTime>
		<debug />
		<idOriginalTransaction />
		<saveClient />
		<saveAccount />
		<saveAsRecurringPayment />
		<emailReceipt />
		<host />
		<approved>false</approved>
	</Transaction>
	<Transaction>
		<id>2</id>
		<idMerchant>22</idMerchant>
		<idTerminal>222</idTerminal>
		<idClerk>2222</idClerk>
		<idClient>22222</idClient>
		<mode>Credit</mode>
		<operation>Sale</operation>
		<cardBrand>Visa</cardBrand>
		<subTotalAmount>222.22</subTotalAmount>
		<tipAmount>0</tipAmount>
		<taxAmount>0</taxAmount>
		<totalAmount>222.22</totalAmount>
		<cvv />
		<xxxclient />
		<cardHolderEmail />
		<geoLocation/>
		<signature />
		<account />
		<allowPartialAuth>false</allowPartialAuth>
		<formatID />
		<ksn />
		<encTrack1AndTrack2 />
		<track1Length />
		<track2Length />
		<maskedPAN />
		<swipe />
		<pin />
		<authNumber />
		<disposition>APPROVED 0091</disposition>
		<sequence>17</sequence>
		<approvalNumber/>
		<approvalCode>91</approvalCode>
		<accountSuffix>4242</accountSuffix>
		<voided>false</voided>
		<poNumber />
		<invoiceNumber />
		<createdAt>1383176096000</createdAt>
		<finalized>false</finalized>
		<hostCapture>true</hostCapture>
		<retrievalData>131030193503000000000000000</retrievalData>
		<batchNumber>131030999</batchNumber>
		<cvvResult />
		<entryMethod>0</entryMethod>
		<debugMessage />
		<amountAuthorized>0</amountAuthorized>
		<originalSequenceNumber />
		<originalApprovalNumber />
		<originalRetrievalData />
		<originalCVVResult />
		<clientStartTime>0</clientStartTime>
		<frontStartTime>0</frontStartTime>
		<debug />
		<idOriginalTransaction />
		<saveClient />
		<saveAccount />
		<saveAsRecurringPayment />
		<emailReceipt />
		<host />
		<approved>false</approved>
	</Transaction>
	<Transaction>
		<id>3</id>
		<idMerchant>33</idMerchant>
		<idTerminal>333</idTerminal>
		<idClerk>3333</idClerk>
		<idClient>33333</idClient>
		<mode>Credit</mode>
		<operation>Sale</operation>
		<cardBrand>Visa</cardBrand>
		<subTotalAmount>333.33</subTotalAmount>
		<tipAmount>0</tipAmount>
		<taxAmount>0</taxAmount>
		<totalAmount>333.33</totalAmount>
		<cvv />
		<xxxclient />
		<cardHolderEmail />
		<geoLocation/>
		<signature />
		<account />
		<allowPartialAuth>false</allowPartialAuth>
		<formatID />
		<ksn />
		<encTrack1AndTrack2 />
		<track1Length />
		<track2Length />
		<maskedPAN />
		<swipe />
		<pin />
		<authNumber />
		<disposition>DENIED 0091</disposition>
		<sequence>17</sequence>
		<approvalNumber/>
		<approvalCode>91</approvalCode>
		<accountSuffix>4242</accountSuffix>
		<voided>false</voided>
		<poNumber />
		<invoiceNumber />
		<createdAt>1383176096000</createdAt>
		<finalized>false</finalized>
		<hostCapture>true</hostCapture>
		<retrievalData>131030193503000000000000000</retrievalData>
		<batchNumber>131030999</batchNumber>
		<cvvResult />
		<entryMethod>0</entryMethod>
		<debugMessage />
		<amountAuthorized>0</amountAuthorized>
		<originalSequenceNumber />
		<originalApprovalNumber />
		<originalRetrievalData />
		<originalCVVResult />
		<clientStartTime>0</clientStartTime>
		<frontStartTime>0</frontStartTime>
		<debug />
		<idOriginalTransaction />
		<saveClient />
		<saveAccount />
		<saveAsRecurringPayment />
		<emailReceipt />
		<host />
		<approved>false</approved>
	</Transaction>

	<Transaction>
		<id>1</id>
		<idMerchant>11</idMerchant>
		<idTerminal>111</idTerminal>
		<idClerk>1111</idClerk>
		<idClient>11111</idClient>
		<mode>Credit</mode>
		<operation>Sale</operation>
		<cardBrand>Visa</cardBrand>
		<subTotalAmount>1111.11</subTotalAmount>
		<tipAmount>0</tipAmount>
		<taxAmount>0</taxAmount>
		<totalAmount>1111.11</totalAmount>
		<cvv />
		<xxxclient />
		<cardHolderEmail />
		<geoLocation/>
		<signature />
		<account />
		<allowPartialAuth>false</allowPartialAuth>
		<formatID />
		<ksn />
		<encTrack1AndTrack2 />
		<track1Length />
		<track2Length />
		<maskedPAN />
		<swipe />
		<pin />
		<authNumber />
		<disposition>DENIED 0091</disposition>
		<sequence>17</sequence>
		<approvalNumber/>
		<approvalCode>91</approvalCode>
		<accountSuffix>4242</accountSuffix>
		<voided>false</voided>
		<poNumber />
		<invoiceNumber />
		<createdAt>1383176096000</createdAt>
		<finalized>false</finalized>
		<hostCapture>true</hostCapture>
		<retrievalData>131030193503000000000000000</retrievalData>
		<batchNumber>131030999</batchNumber>
		<cvvResult />
		<entryMethod>0</entryMethod>
		<debugMessage />
		<amountAuthorized>0</amountAuthorized>
		<originalSequenceNumber />
		<originalApprovalNumber />
		<originalRetrievalData />
		<originalCVVResult />
		<clientStartTime>0</clientStartTime>
		<frontStartTime>0</frontStartTime>
		<debug />
		<idOriginalTransaction />
		<saveClient />
		<saveAccount />
		<saveAsRecurringPayment />
		<emailReceipt />
		<host />
		<approved>false</approved>
	</Transaction>
	<Transaction>
		<id>2</id>
		<idMerchant>22</idMerchant>
		<idTerminal>222</idTerminal>
		<idClerk>2222</idClerk>
		<idClient>22222</idClient>
		<mode>Credit</mode>
		<operation>Sale</operation>
		<cardBrand>Visa</cardBrand>
		<subTotalAmount>2222.22</subTotalAmount>
		<tipAmount>0</tipAmount>
		<taxAmount>0</taxAmount>
		<totalAmount>222.22</totalAmount>
		<cvv />
		<xxxclient />
		<cardHolderEmail />
		<geoLocation/>
		<signature />
		<account />
		<allowPartialAuth>false</allowPartialAuth>
		<formatID />
		<ksn />
		<encTrack1AndTrack2 />
		<track1Length />
		<track2Length />
		<maskedPAN />
		<swipe />
		<pin />
		<authNumber />
		<disposition>DENIED 0091</disposition>
		<sequence>17</sequence>
		<approvalNumber/>
		<approvalCode>91</approvalCode>
		<accountSuffix>4242</accountSuffix>
		<voided>false</voided>
		<poNumber />
		<invoiceNumber />
		<createdAt>1383176096000</createdAt>
		<finalized>false</finalized>
		<hostCapture>true</hostCapture>
		<retrievalData>131030193503000000000000000</retrievalData>
		<batchNumber>131030999</batchNumber>
		<cvvResult />
		<entryMethod>0</entryMethod>
		<debugMessage />
		<amountAuthorized>0</amountAuthorized>
		<originalSequenceNumber />
		<originalApprovalNumber />
		<originalRetrievalData />
		<originalCVVResult />
		<clientStartTime>0</clientStartTime>
		<frontStartTime>0</frontStartTime>
		<debug />
		<idOriginalTransaction />
		<saveClient />
		<saveAccount />
		<saveAsRecurringPayment />
		<emailReceipt />
		<host />
		<approved>false</approved>
	</Transaction>
	<Transaction>
		<id>3</id>
		<idMerchant>33</idMerchant>
		<idTerminal>333</idTerminal>
		<idClerk>3333</idClerk>
		<idClient>33333</idClient>
		<mode>Credit</mode>
		<operation>Sale</operation>
		<cardBrand>Visa</cardBrand>
		<subTotalAmount>3333.33</subTotalAmount>
		<tipAmount>0</tipAmount>
		<taxAmount>0</taxAmount>
		<totalAmount>3333.33</totalAmount>
		<cvv />
		<xxxclient />
		<cardHolderEmail />
		<geoLocation/>
		<signature />
		<account />
		<allowPartialAuth>false</allowPartialAuth>
		<formatID />
		<ksn />
		<encTrack1AndTrack2 />
		<track1Length />
		<track2Length />
		<maskedPAN />
		<swipe />
		<pin />
		<authNumber />
		<disposition>DENIED 0091</disposition>
		<sequence>17</sequence>
		<approvalNumber/>
		<approvalCode>91</approvalCode>
		<accountSuffix>4242</accountSuffix>
		<voided>false</voided>
		<poNumber />
		<invoiceNumber />
		<createdAt>1383176096000</createdAt>
		<finalized>false</finalized>
		<hostCapture>true</hostCapture>
		<retrievalData>131030193503000000000000000</retrievalData>
		<batchNumber>131030999</batchNumber>
		<cvvResult />
		<entryMethod>0</entryMethod>
		<debugMessage />
		<amountAuthorized>0</amountAuthorized>
		<originalSequenceNumber />
		<originalApprovalNumber />
		<originalRetrievalData />
		<originalCVVResult />
		<clientStartTime>0</clientStartTime>
		<frontStartTime>0</frontStartTime>
		<debug />
		<idOriginalTransaction />
		<saveClient />
		<saveAccount />
		<saveAsRecurringPayment />
		<emailReceipt />
		<host />
		<approved>false</approved>
	</Transaction>

	<Transaction>
		<id>1</id>
		<idMerchant>11</idMerchant>
		<idTerminal>111</idTerminal>
		<idClerk>1111</idClerk>
		<idClient>11111</idClient>
		<mode>Credit</mode>
		<operation>Sale</operation>
		<cardBrand>Visa</cardBrand>
		<subTotalAmount>11111.11</subTotalAmount>
		<tipAmount>0</tipAmount>
		<taxAmount>0</taxAmount>
		<totalAmount>11111.11</totalAmount>
		<cvv />
		<xxxclient />
		<cardHolderEmail />
		<geoLocation/>
		<signature />
		<account />
		<allowPartialAuth>false</allowPartialAuth>
		<formatID />
		<ksn />
		<encTrack1AndTrack2 />
		<track1Length />
		<track2Length />
		<maskedPAN />
		<swipe />
		<pin />